{
  "schemaVersion": "1.0",
  "workspaceId": "sample-workspace",
  "projectName": "예시 애플리케이션",
  "generatedAt": "2026-01-01T00:00:00Z",
  "report": {
    "id": "sample-report",
    "pdf": "input/sample-report.pdf",
    "spreadsheet": "input/sample-findings.xlsx",
    "generatedAt": "2026-01-01T00:00:00Z",
    "findingCount": 1,
    "inputsMatch": true,
    "mismatchReason": ""
  },
  "technology": {
    "languages": ["예시 언어"],
    "frameworks": ["예시 프레임워크"],
    "buildTools": ["예시 빌드 도구"],
    "testFrameworks": ["예시 테스트 프레임워크"]
  },
  "paths": {
    "sourceRoots": ["src"],
    "testRoots": ["test"],
    "configRoots": ["config"],
    "templateRoots": ["templates"]
  },
  "modules": [
    {
      "name": "application",
      "path": "src/application",
      "role": "애플리케이션 업무 로직",
      "dependencies": [],
      "testPath": "test/application"
    }
  ],
  "validation": {
    "compileCommands": ["<프로젝트에서 확인한 컴파일 명령>"],
    "testCommands": ["<프로젝트에서 확인한 테스트 명령>"],
    "successSignals": ["성공 종료 코드와 예상 출력"],
    "limitations": []
  },
  "constraints": [
    {
      "scope": "외부 프로토콜",
      "rule": "호환성을 검증하기 전에는 명세에 있는 데이터 형식을 유지합니다.",
      "source": "baseline"
    }
  ],
  "analysisSummary": {
    "exactMappings": 1,
    "relocatedMappings": 0,
    "notFoundMappings": 0
  }
}
